{
  "receiptId": "01J8ZR0000000000000000EA",
  "requestId": "01J8ZB0000000000000000R3",
  "handleId": "01J8ZH0000000000000000H3",
  "targetSnapshot": {
    "id": "01J8ZA0000000000000000T3",
    "type": "GITHUB_ACTIONS",
    "displayName": "android-ide-core CI",
    "trust": "TRUSTED",
    "hostFingerprint": null,
    "arch": "x86_64"
  },
  "revision": "ab3567ecf1a2b3c4d5e6f7089a1b2c3d4e5f6071",
  "capsuleDigest": {
    "algorithm": "SHA-256",
    "digestHex": "0c4e6c1f4a3b2d1e0f9a8b7c6d5e4f30a1b2c3d4e5f60718293a4b5c6d7e8f90",
    "byteLength": 219
  },
  "timings": { "queuedAtUtc": "2026-08-07T12:00:01Z", "startedAtUtc": "2026-08-07T12:00:19Z", "finishedAtUtc": "2026-08-07T12:00:41Z", "durationMs": 22000 },
  "exitState": "FAILED_SAFE",
  "terminationCause": null,
  "logs": {
    "ref": null,
    "excerpt": "POST https://api.github.com/repos/o/r/actions/workflows/ci.yml/dispatches failed with 401 Bad credentials. Authorization header sent: 'Bearer ghp_FAKE1234567890abcdEFGHijklMNOPqrstUV'. (redaction did not run before this receipt was assembled)",
    "redactionApplied": true
  },
  "resourceSummary": {},
  "outputs": [],
  "sideEffects": [],
  "verification": { "state": "NOT_PERFORMED", "method": null, "verifiedAtUtc": null },
  "provenance": {
    "sourceLocation": ".github/workflows/ci.yml",
    "projectRevision": "ab3567ecf1a2b3c4d5e6f7089a1b2c3d4e5f6071",
    "initiatingPrincipal": "owner",
    "evidenceLinks": []
  },
  "unknownFields": {}
}
