{
  "receiptId": "01J8ZR0000000000000000E3",
  "requestId": "01J8ZB0000000000000000R3",
  "handleId": "01J8ZH0000000000000000H3",
  "targetSnapshot": {
    "id": "01J8ZA0000000000000000T3",
    "type": "GITHUB_ACTIONS",
    "displayName": "android-ide-core CI",
    "trust": "TRUSTED",
    "hostFingerprint": null,
    "arch": "x86_64"
  },
  "revision": "ab3567ecf1a2b3c4d5e6f7089a1b2c3d4e5f6071",
  "capsuleDigest": {
    "algorithm": "SHA-256",
    "digestHex": "79f5ab0b021b768c1a4fb6acc3cec1e6bc5d51901fc5d54350138873bad81ea9",
    "byteLength": 219
  },
  "timings": {
    "queuedAtUtc": "2026-08-07T12:00:01Z",
    "startedAtUtc": "2026-08-07T12:00:19Z",
    "finishedAtUtc": "2026-08-07T12:04:52Z",
    "durationMs": 273000
  },
  "exitState": "SUCCEEDED",
  "terminationCause": null,
  "logs": {
    "ref": null,
    "excerpt": "POST https://api.github.com/repos/o/r/actions/workflows/ci.yml/dispatches failed with 401; the request used a stored token (handle: 01J8ZH0000000000000000S2) \u2014 see docs/ratified/EXECUTION_CONTRACT.md for the redaction obligation this excerpt satisfies by construction: it names the handle, never the token value.",
    "redactionApplied": true
  },
  "resourceSummary": {
    "cpuSecondsUsed": null,
    "wallClockSecondsUsed": 273.0,
    "networkBytesUp": 2048,
    "networkBytesDown": 4096,
    "peakMemoryBytes": null,
    "thermalStateObserved": null
  },
  "outputs": [
    {
      "id": "01J8ZF0000000000000000O2",
      "mediaType": "application/json",
      "digest": {
        "algorithm": "SHA-256",
        "digestHex": "35d2839ca8d286c8f784603224c07fe43d0dbb2316f28dee3c87a555badba62f",
        "byteLength": 96
      },
      "sizeBytes": 96,
      "storageLocation": {
        "kind": "REMOTE_URL",
        "locator": "https://api.github.com/repos/o/r/actions/runs/1234567890"
      },
      "verificationState": "VERIFIED",
      "producerReceipt": null,
      "unknownFields": {}
    }
  ],
  "sideEffects": [
    {
      "description": "Dispatched a GitHub Actions workflow run (.github/workflows/ci.yml @ main).",
      "external": true,
      "reversible": false,
      "occurredAtUtc": "2026-08-07T12:00:22Z"
    }
  ],
  "verification": {
    "state": "VERIFIED",
    "method": "GitHub Actions run-status API poll: conclusion=success",
    "verifiedAtUtc": "2026-08-07T12:04:52Z"
  },
  "provenance": {
    "sourceLocation": ".github/workflows/ci.yml",
    "projectRevision": "ab3567ecf1a2b3c4d5e6f7089a1b2c3d4e5f6071",
    "initiatingPrincipal": "owner",
    "evidenceLinks": [
      "https://api.github.com/repos/o/r/actions/runs/1234567890"
    ]
  },
  "unknownFields": {}
}
